{
  "manifest_version": 1,
  "kind": "vision_classifier",
  "run_id": "stable-mobilenetv3-large-2026-09",
  "architecture": "mobilenet_v3_large",
  "model": {
    "path": "mobilenetv3_large_vision.onnx",
    "format": "onnx",
    "sha256": "b3a42e8dd4553355b1fd7d9e7fe3d28e318decb894e76eb029489b7ff2e90bcf"
  },
  "input": {"shape": [1, 3, 224, 224], "dtype": "float32", "layout": "NCHW", "color": "RGB"},
  "preprocess": "rgb_resize_224_bilinear_no_crop_div255_imagenet",
  "output": {"kind": "logits", "shape": [1, 10]},
  "classes": ["c0", "c1", "c2", "c3", "c4", "c5", "c6", "c7", "c8", "c9"],
  "class_to_idx": {"c0": 0, "c1": 1, "c2": 2, "c3": 3, "c4": 4, "c5": 5, "c6": 6, "c7": 7, "c8": 8, "c9": 9},
  "safe_class": "c0",
  "contract_smoke_set": {
    "split": "val",
    "selection": "first 20 filenames per class, sorted, from vision_metadata_with_split.csv (sha256 b4f8e90d...)",
    "n": 200,
    "sample_ids_sha256": "601dc3ed6b99e9030f6eb5287e711baf529ea6c0c5b2facab0acd9c3f9373be9",
    "rule": "per_class_mode_equals_label"
  },
  "provenance": {
    "checkpoint": "mobilenetv3_large_vision.pt (sha256 196ca7b1...), classes c0..c9 in index order, arch mobilenet_v3_large",
    "note": "The frozen stable model, described in the candidate format so that stable and candidate load through one path."
  }
}
